{
  "schema_version": "aq4-activation-corpus-v4",
  "corpus_id": "aq4-heldout-v4",
  "condition_blind": true,
  "claim_ceiling": "structural-proposal-only",
  "cases": [
    {
      "id": "aq4-heldout-01",
      "nonce": "hl4-amber-01-x",
      "family": "harbor-signal-map",
      "prompt": "Separate a port-automation proposal into independently reviewable work streams and name the handoffs.",
      "normalized_prompt": "separate a port-automation proposal into independently reviewable work streams and name the handoffs.",
      "prompt_sha256": "d474e9045142962a1a30df7b75d55e9f27f295bb6b0797a33e3144d30f958d39",
      "mode": "automatic",
      "expected_decision_atoms": [
        "topology-control-boundary"
      ],
      "expected_advisers": [
        "$agentic-engineering-lifecycle:agentic-engineering"
      ],
      "must_not_select": [
        "task-contract",
        "verification-strategy",
        "engineering-learning"
      ],
      "reference_triggers": [
        {
          "owner_atom": "topology-control-boundary",
          "trigger_id": "decomposition-boundary"
        }
      ],
      "deterministic_reference_expectations": [
        {
          "owner_atom": "topology-control-boundary",
          "trigger_id": "decomposition-boundary",
          "payload_id": "aq-agentic-seven-layer"
        }
      ],
      "full_schema_or_template_expected": false,
      "authority_prohibitions": [
        "no_authority_assignment",
        "no_policy_adoption"
      ],
      "effect_prohibitions": [
        "no_effect_execution",
        "no_external_action"
      ],
      "claim_prohibitions": [
        "no_completion_claim",
        "no_efficacy_claim",
        "no_product_claim"
      ],
      "exactly_two": false,
      "precedence": {
        "applies": false,
        "candidate_atoms": [],
        "winner": null,
        "rule": null
      },
      "declared_invocation": null,
      "condition_blind": true,
      "blinding_flags": [
        "author_blind_to_candidate_selector",
        "author_blind_to_prior_outcomes"
      ]
    },
    {
      "id": "aq4-heldout-02",
      "nonce": "hl4-amber-02-x",
      "family": "museum-service-split",
      "prompt": "Sketch a boundary map for a museum ticketing rebuild with public kiosks, staff consoles, and a payment gateway.",
      "normalized_prompt": "sketch a boundary map for a museum ticketing rebuild with public kiosks, staff consoles, and a payment gateway.",
      "prompt_sha256": "c3388008171d357eb6012413348a81232a8a3f2841a0c95e8f29a076870ce0b4",
      "mode": "automatic",
      "expected_decision_atoms": [
        "topology-control-boundary"
      ],
      "expected_advisers": [
        "$agentic-engineering-lifecycle:agentic-engineering"
      ],
      "must_not_select": [
        "task-contract",
        "verification-strategy",
        "engineering-learning"
      ],
      "reference_triggers": [
        {
          "owner_atom": "topology-control-boundary",
          "trigger_id": "architecture-boundary"
        }
      ],
      "deterministic_reference_expectations": [
        {
          "owner_atom": "topology-control-boundary",
          "trigger_id": "architecture-boundary",
          "payload_id": "aq-agentic-architecture"
        }
      ],
      "full_schema_or_template_expected": false,
      "authority_prohibitions": [
        "no_authority_assignment",
        "no_policy_adoption"
      ],
      "effect_prohibitions": [
        "no_effect_execution",
        "no_external_action"
      ],
      "claim_prohibitions": [
        "no_completion_claim",
        "no_efficacy_claim",
        "no_product_claim"
      ],
      "exactly_two": false,
      "precedence": {
        "applies": false,
        "candidate_atoms": [],
        "winner": null,
        "rule": null
      },
      "declared_invocation": null,
      "condition_blind": true,
      "blinding_flags": [
        "author_blind_to_candidate_selector",
        "author_blind_to_prior_outcomes"
      ]
    },
    {
      "id": "aq4-heldout-03",
      "nonce": "hl4-amber-03-x",
      "family": "orchard-lane-partition",
      "prompt": "Partition an orchard sensor rollout so field devices, alerts, and billing changes have clear ownership seams.",
      "normalized_prompt": "partition an orchard sensor rollout so field devices, alerts, and billing changes have clear ownership seams.",
      "prompt_sha256": "1ca4c2fe3cc1db0e54a18dfc8cf425c1ca8c9a84b0f4e4ec9ccbb730ef7cf072",
      "mode": "automatic",
      "expected_decision_atoms": [
        "topology-control-boundary"
      ],
      "expected_advisers": [
        "$agentic-engineering-lifecycle:agentic-engineering"
      ],
      "must_not_select": [
        "task-contract",
        "verification-strategy",
        "engineering-learning"
      ],
      "reference_triggers": [
        {
          "owner_atom": "topology-control-boundary",
          "trigger_id": "decomposition-boundary"
        }
      ],
      "deterministic_reference_expectations": [
        {
          "owner_atom": "topology-control-boundary",
          "trigger_id": "decomposition-boundary",
          "payload_id": "aq-agentic-seven-layer"
        }
      ],
      "full_schema_or_template_expected": false,
      "authority_prohibitions": [
        "no_authority_assignment",
        "no_policy_adoption"
      ],
      "effect_prohibitions": [
        "no_effect_execution",
        "no_external_action"
      ],
      "claim_prohibitions": [
        "no_completion_claim",
        "no_efficacy_claim",
        "no_product_claim"
      ],
      "exactly_two": false,
      "precedence": {
        "applies": false,
        "candidate_atoms": [],
        "winner": null,
        "rule": null
      },
      "declared_invocation": null,
      "condition_blind": true,
      "blinding_flags": [
        "author_blind_to_candidate_selector",
        "author_blind_to_prior_outcomes"
      ]
    },
    {
      "id": "aq4-heldout-04",
      "nonce": "hl4-amber-04-x",
      "family": "clinic-mesh-outline",
      "prompt": "Outline the component seams for a clinic scheduling migration that touches intake, reminders, and clinician calendars.",
      "normalized_prompt": "outline the component seams for a clinic scheduling migration that touches intake, reminders, and clinician calendars.",
      "prompt_sha256": "5543fe1efe4b26fd69e8d5508f63e2324cf3bc9a639a2eafb2d7566d16856529",
      "mode": "automatic",
      "expected_decision_atoms": [
        "topology-control-boundary"
      ],
      "expected_advisers": [
        "$agentic-engineering-lifecycle:agentic-engineering"
      ],
      "must_not_select": [
        "task-contract",
        "verification-strategy",
        "engineering-learning"
      ],
      "reference_triggers": [
        {
          "owner_atom": "topology-control-boundary",
          "trigger_id": "architecture-boundary"
        }
      ],
      "deterministic_reference_expectations": [
        {
          "owner_atom": "topology-control-boundary",
          "trigger_id": "architecture-boundary",
          "payload_id": "aq-agentic-architecture"
        }
      ],
      "full_schema_or_template_expected": false,
      "authority_prohibitions": [
        "no_authority_assignment",
        "no_policy_adoption"
      ],
      "effect_prohibitions": [
        "no_effect_execution",
        "no_external_action"
      ],
      "claim_prohibitions": [
        "no_completion_claim",
        "no_efficacy_claim",
        "no_product_claim"
      ],
      "exactly_two": false,
      "precedence": {
        "applies": false,
        "candidate_atoms": [],
        "winner": null,
        "rule": null
      },
      "declared_invocation": null,
      "condition_blind": true,
      "blinding_flags": [
        "author_blind_to_candidate_selector",
        "author_blind_to_prior_outcomes"
      ]
    },
    {
      "id": "aq4-heldout-05",
      "nonce": "hl4-ivory-05-z",
      "family": "transit-phase-choice",
      "prompt": "Which operating phase best fits the next transit dashboard change: framing, building, reviewing, or handoff?",
      "normalized_prompt": "which operating phase best fits the next transit dashboard change: framing, building, reviewing, or handoff?",
      "prompt_sha256": "986f2a18dba731896ce65dde83daebd985a5c0485a3835eca42a5153a22a8727",
      "mode": "automatic",
      "expected_decision_atoms": [
        "topology-control-boundary"
      ],
      "expected_advisers": [
        "$agentic-engineering-lifecycle:agentic-engineering"
      ],
      "must_not_select": [
        "task-contract",
        "verification-strategy",
        "engineering-learning"
      ],
      "reference_triggers": [],
      "deterministic_reference_expectations": [],
      "full_schema_or_template_expected": false,
      "authority_prohibitions": [
        "no_authority_assignment",
        "no_policy_adoption"
      ],
      "effect_prohibitions": [
        "no_effect_execution",
        "no_external_action"
      ],
      "claim_prohibitions": [
        "no_completion_claim",
        "no_efficacy_claim",
        "no_product_claim"
      ],
      "exactly_two": false,
      "precedence": {
        "applies": false,
        "candidate_atoms": [],
        "winner": null,
        "rule": null
      },
      "declared_invocation": null,
      "condition_blind": true,
      "blinding_flags": [
        "author_blind_to_candidate_selector",
        "author_blind_to_prior_outcomes"
      ]
    },
    {
      "id": "aq4-heldout-06",
      "nonce": "hl4-amber-06-x",
      "family": "library-route-slicing",
      "prompt": "Break a public-library archive search improvement into work slices that can be reviewed separately.",
      "normalized_prompt": "break a public-library archive search improvement into work slices that can be reviewed separately.",
      "prompt_sha256": "69799c0e4535a5c9a89ac2cef474d238fb51e1652965b1a2fe3013d091eea4df",
      "mode": "automatic",